{
  "schema": "rhei.accounting.prices.v1",
  "price_book_id": "foundation-site-2026-09-02",
  "currency": "USD",
  "entries": [
    {
      "provider": "anthropic",
      "model": "claude-opus-5",
      "effective_at": "2026-09-02T00:00:00Z",
      "unit": "1m_tokens",
      "input_total_micro": 5000000,
      "input_cached_read_micro": 500000,
      "input_cache_write_micro": 6250000,
      "output_total_micro": 25000000
    },
    {
      "provider": "anthropic",
      "model": "claude-fable-5",
      "effective_at": "2026-09-02T00:00:00Z",
      "unit": "1m_tokens",
      "input_total_micro": 10000000,
      "input_cached_read_micro": 1000000,
      "input_cache_write_micro": 12500000,
      "output_total_micro": 50000000
    },
    {
      "provider": "anthropic",
      "model": "claude-sonnet-5",
      "effective_at": "2026-09-02T00:00:00Z",
      "unit": "1m_tokens",
      "input_total_micro": 2000000,
      "input_cached_read_micro": 200000,
      "input_cache_write_micro": 2500000,
      "output_total_micro": 10000000
    },
    {
      "provider": "anthropic",
      "model": "claude-sonnet-4-6",
      "effective_at": "2026-09-02T00:00:00Z",
      "unit": "1m_tokens",
      "input_total_micro": 3000000,
      "input_cached_read_micro": 300000,
      "input_cache_write_micro": 3750000,
      "output_total_micro": 15000000
    },
    {
      "provider": "openai",
      "model": "gpt-5.6-sol",
      "effective_at": "2026-09-02T00:00:00Z",
      "unit": "1m_tokens",
      "input_total_micro": 4000000,
      "input_cached_read_micro": 400000,
      "input_cache_write_micro": 4000000,
      "output_total_micro": 20000000
    },
    {
      "provider": "openai",
      "model": "gpt-5.6-luna",
      "effective_at": "2026-09-02T00:00:00Z",
      "unit": "1m_tokens",
      "input_total_micro": 200000,
      "input_cached_read_micro": 20000,
      "input_cache_write_micro": 200000,
      "output_total_micro": 1200000
    }
  ]
}
